{
  "version": "people-sources-v1",
  "generatedAt": "2026-08-02T04:41:32.516Z",
  "ordering": "source-id-ascending",
  "sourceCount": 15,
  "sources": [
    {
      "sourceId": "filmaholic-top100-actors-2026",
      "displayTitle": "Filmaholic Top 100 Actors",
      "sourceType": "editorial-ranked-list",
      "sourceUrl": "https://thefilmaholic.com/top100/actors",
      "sourceFile": "tools/people-seed/.work/actor-owner-supplement-review/source-snapshots/preceding-comparison-evidence.json",
      "publicationOrSnapshotYear": 2026,
      "retrievalTimestamp": "2026-07-18T00:00:00.000Z",
      "sourceHash": null,
      "extractionMethod": "Direct rendered access was Cloudflare-blocked; the complete exact page was obtained through a recent search-engine crawl and the captured ranks were preserved for the 64 owner-selected occurrences.",
      "completenessStatement": "The complete top-100 list was available through the recent crawl of the exact page, not through direct rendered access.",
      "knownLimitations": [
        "Direct rendered access was Cloudflare-blocked.",
        "The source was weighted conservatively because it was recovered through a search-engine crawl.",
        "Owner inclusion decisions, rather than this source alone, govern promotion.",
        "Ranks are provenance, not acting quality."
      ],
      "rankingDynamicWarning": null
    },
    {
      "sourceId": "imdb-actor-list-ls548798415",
      "displayTitle": "IMDb actor list ls548798415",
      "sourceType": "editorial-user-list",
      "sourceUrl": "https://www.imdb.com/list/ls548798415/",
      "sourceFile": "tools/people-seed/.work/actor-owner-supplement-review/source-snapshots/preceding-comparison-evidence.json",
      "publicationOrSnapshotYear": 2026,
      "retrievalTimestamp": "2026-07-18T00:00:00.000Z",
      "sourceHash": null,
      "extractionMethod": "Preserved the directly retrieved IMDb user-list comparison as discovery provenance; no individual rank was fabricated where the local comparison evidence did not retain one.",
      "completenessStatement": "The complete compared IMDb list was directly retrieved during the owner comparison.",
      "knownLimitations": [
        "IMDb user list; its selection and ordering are not objective measures of acting quality."
      ],
      "rankingDynamicWarning": null
    },
    {
      "sourceId": "imdb-popular-celebrities-ls052283250",
      "displayTitle": "IMDb popular celebrities list ls052283250",
      "sourceType": "editorial-user-list",
      "sourceUrl": "https://www.imdb.com/list/ls052283250/",
      "sourceFile": "tools/people-seed/.work/actor-owner-supplement-review/source-snapshots/preceding-comparison-evidence.json",
      "publicationOrSnapshotYear": 2026,
      "retrievalTimestamp": "2026-07-18T00:00:00.000Z",
      "sourceHash": null,
      "extractionMethod": "Preserved the directly retrieved IMDb popular-celebrities comparison as discovery provenance; no individual rank was fabricated where the local comparison evidence did not retain one.",
      "completenessStatement": "The complete compared IMDb list was directly retrieved during the owner comparison.",
      "knownLimitations": [
        "IMDb user list; popularity and editorial selection are not objective measures of acting quality."
      ],
      "rankingDynamicWarning": null
    },
    {
      "sourceId": "imdb-starmeter-2026-07-18",
      "displayTitle": "IMDb STARmeter",
      "sourceType": "dynamic-weekly-popularity-chart",
      "sourceUrl": "https://www.imdb.com/chart/starmeter/",
      "sourceFile": "tools/people-seed/.work/actor-owner-supplement-review/source-snapshots/preceding-comparison-evidence.json",
      "publicationOrSnapshotYear": 2026,
      "retrievalTimestamp": "2026-07-18T00:00:00.000Z",
      "sourceHash": null,
      "extractionMethod": "Preserved the July 18, 2026 STARmeter snapshot and only the individual ranks retained with confidence in the approved comparison evidence.",
      "completenessStatement": "The complete 100-person STARmeter chart was directly retrieved; 45 owner-approved actor occurrences are represented and ranks remain null where not safely retained.",
      "knownLimitations": [
        "STARmeter is a volatile weekly popularity snapshot.",
        "Weekly rank does not establish durable acting importance, quality, or final rollout priority."
      ],
      "rankingDynamicWarning": "Volatile weekly snapshot captured July 18, 2026; ranks can change each week."
    },
    {
      "sourceId": "imkaptain-actors",
      "displayTitle": "ImKaptain actor identity cross-check",
      "sourceType": "external-catalog-cross-check",
      "sourceUrl": "https://raw.githubusercontent.com/ImKaptain/nuvio-assets/9f1d4de802e828c1ed8dee9b53a6051880d2babd/nuvio-share-hub/collections/actors.json",
      "sourceFile": "tools/studio-network-batch/.work/imkaptain-identity-comparison/external-inputs/actors.json",
      "publicationOrSnapshotYear": 2026,
      "retrievalTimestamp": "2026-07-16T03:29:01.591Z",
      "sourceHash": {
        "algorithm": "sha256",
        "value": "4fbf5ac0b0cc43f1ac97292dfe835f54a96be24208d369a7026a021f83608645",
        "scope": "complete pinned actors.json response"
      },
      "extractionMethod": "Read 58 explicit TMDB person IDs from the validated text-only identity inventory; artwork fields were excluded.",
      "completenessStatement": "All 58 actor identity records in the pinned cross-check file are represented as source memberships.",
      "knownLimitations": [
        "Cross-check source only; absence from Ranker does not imply final Nuvio inclusion."
      ],
      "rankingDynamicWarning": null
    },
    {
      "sourceId": "imkaptain-directors",
      "displayTitle": "ImKaptain director catalogue cross-check",
      "sourceType": "external-catalog-cross-check",
      "sourceUrl": "https://raw.githubusercontent.com/ImKaptain/nuvio-assets/9f1d4de802e828c1ed8dee9b53a6051880d2babd/nuvio-share-hub/collections/legendary_directors.json",
      "sourceFile": "tools/studio-network-batch/.work/imkaptain-identity-comparison/external-inputs/legendary_directors.json",
      "publicationOrSnapshotYear": 2026,
      "retrievalTimestamp": "2026-07-16T03:29:01.591Z",
      "sourceHash": {
        "algorithm": "sha256",
        "value": "73b52b70bc9e0491fe329d737c64a9cdf67ead53d6b0c515fef69a5e856283fe",
        "scope": "complete pinned legendary_directors.json response"
      },
      "extractionMethod": "Retained 20 MDBList catalogue references as secondary provenance and resolved people independently through TMDB metadata.",
      "completenessStatement": "All 20 director catalogue records in the pinned cross-check file are represented as source memberships.",
      "knownLimitations": [
        "MDBList catalogue IDs identify source catalogues, not TMDB people, and must never be used as TMDB person IDs."
      ],
      "rankingDynamicWarning": null
    },
    {
      "sourceId": "owner-actor-supplement-2026-07",
      "displayTitle": "Nuvio owner actor supplement decision",
      "sourceType": "owner-decision-after-cross-source-comparison",
      "sourceUrl": null,
      "sourceFile": "data/people/actor-owner-supplement.json",
      "publicationOrSnapshotYear": 2026,
      "retrievalTimestamp": "2026-07-18T00:00:00.000Z",
      "sourceHash": null,
      "extractionMethod": "Recorded the explicit owner decision after the bounded cross-source comparison and metadata-only identity resolution.",
      "completenessStatement": "All 198 additions were explicitly approved for inclusion; the proposed split of 95 initial and 103 later actors was subsequently approved with zero review additions.",
      "knownLimitations": [
        "Inclusion and rollout are owner catalogue decisions, not an objective ranking of performers."
      ],
      "rankingDynamicWarning": null
    },
    {
      "sourceId": "owner-people-v3-actors-2026-08",
      "displayTitle": "Nuvio owner-approved People v3 Actor memberships",
      "sourceType": "owner-approved-membership-package",
      "sourceUrl": null,
      "sourceFile": "data/people/people-owner-supplement-v3.json",
      "publicationOrSnapshotYear": 2026,
      "retrievalTimestamp": null,
      "sourceHash": {
        "algorithm": "sha256",
        "value": "4cfa65603935726d21fef8ce6919f344e6ab834f7a8b730711415ecef730d650",
        "scope": "complete authoritative package payload embedded in the tracked People owner supplement v3"
      },
      "extractionMethod": "Promoted only exact owner-approved Actor membership actions from the hash-bound tracked People v3 package.",
      "completenessStatement": "All 548 approved Actor membership actions are represented without a fabricated source rank or retrieval timestamp.",
      "knownLimitations": [
        "Catalogue membership approval is not portrait, artwork, manifest, runtime, or publication approval.",
        "Unavailable career snapshot metadata remains null and must not be inferred from category membership."
      ],
      "rankingDynamicWarning": null
    },
    {
      "sourceId": "owner-people-v3-directors-2026-08",
      "displayTitle": "Nuvio owner-approved People v3 Director memberships",
      "sourceType": "owner-approved-membership-package",
      "sourceUrl": null,
      "sourceFile": "data/people/people-owner-supplement-v3.json",
      "publicationOrSnapshotYear": 2026,
      "retrievalTimestamp": null,
      "sourceHash": {
        "algorithm": "sha256",
        "value": "4cfa65603935726d21fef8ce6919f344e6ab834f7a8b730711415ecef730d650",
        "scope": "complete authoritative package payload embedded in the tracked People owner supplement v3"
      },
      "extractionMethod": "Promoted only exact owner-approved Director membership actions from the hash-bound tracked People v3 package.",
      "completenessStatement": "All 118 approved Director membership actions are represented without a fabricated source rank or retrieval timestamp.",